Species,Aspect,Information,Measure
Golden Pothos,Growth Habit,"Golden Pothos is a vigorous vine that can grow over 10 feet in length, suitable for hanging baskets or climbing supports.","Use clean scissors to trim stems close to the base, but not below the soil line."
Golden Pothos,Soil Requirements,"Use a well-draining potting mix to prevent waterlogging, which can lead to root rot.","Use loose, fertile, well-drained soil, such as garden soil with a small amount of perlite or sand."
Golden Pothos,Water Requirements,Water the Golden Pothos when the top inch of soil feels dry to the touch. Avoid overwatering.,Water when the soil surface is dry to the touch. Avoid overwatering.
Golden Pothos,Light Conditions,"Thrives in bright indirect light, but can tolerate lower light conditions. Avoid direct sunlight.",Place in a bright location near a window but avoid direct sunlight.
Golden Pothos,Pests and Diseases,"Golden Pothos can be affected by pests such as aphids, whiteflies, and spider mites.",Monitor for pests and treat with appropriate measures.
Golden Pothos,Control Methods,Treat these pests by first removing any visible pests and then using a mild insecticidal soap or neem oil.,Use a mild insecticidal soap or neem oil as needed.
Golden Pothos,Fertilization Requirements,Golden Pothos is not a heavy feeder. Apply a balanced liquid fertilizer diluted to half strength once every 2-4 weeks during the growing season.,Apply a diluted balanced liquid fertilizer every 2-4 weeks during the growing season.
Golden Pothos,Seasonal Variations,"Requires consistent care throughout the year, with adjustments in watering frequency based on seasonal changes.",Adjust watering frequency according to seasonal changes.
Golden Pothos,Description,Pothos is highly ornamental and can be grown indoors or outdoors for its ornamental value.,Can be trained to climb on supports or hang in various locations.
Golden Pothos,Benefits,Pothos can effectively absorb harmful gases such as formaldehyde and benzene in the air.,Place pothos in areas where air purification is needed.
Golden Pothos,Pharmacological Properties,"According to the 'Compendium of Materia Medica', pothos has medicinal properties that can treat bruises, reduce swelling and pain, and inhibit bacteria.",Use under the guidance of a professional for medicinal purposes.
Golden Pothos,Edible Properties,No known edible properties.,Not applicable.
Golden Pothos,Cultivation Techniques,"Pothos propagation is typically done through cuttings. In late spring and early summer, select robust pothos vines, cut 15-30 cm branches, and insert directly into the cultivation soil.","For propagation, select robust vines, cut branches, and insert into cultivation soil."
Dracaena fragrans,Description,"A tree or shrub that can grow over 6 meters tall in the wild, with thick branches and a scented resin known as 'dragon's blood' that is secreted from the trunk when damaged. Plant can reach over 6 meters in natural habitat but typically smaller as an indoor plant.",Plant can reach over 6 meters in natural habitat but typically smaller as an indoor plant.
Dracaena fragrans,Soil Requirements,"Prefers loose, fertile, well-draining, slightly acidic soil. Use a potting mix designed for tropical plants which typically includes peat, perlite, and sand.","Use a potting mix designed for tropical plants which typically includes peat, perlite, and sand."
Dracaena fragrans,Water Requirements,"Enjoys moisture but dislikes waterlogging; water regularly to maintain moist soil, especially in the growing season. Water when the top inch of soil feels dry to the touch. Reduce watering frequency in winter.",Water when the top inch of soil feels dry to the touch. Reduce watering frequency in winter.
Dracaena fragrans,Light Conditions,"Thrives in bright, indirect sunlight but can tolerate shade; avoid direct sunlight which can scorch the leaves. Place near a window with filtered light or in a well-lit room without direct exposure to sunlight.",Place near a window with filtered light or in a well-lit room without direct exposure to sunlight.
Dracaena fragrans,Fertilization Requirements,Feed with diluted liquid fertilizer bi-weekly during the growing season; reduce feeding in the winter months. Apply a balanced NPK fertilizer diluted to half strength. Avoid over-fertilizing to prevent leaf burn.,Apply a balanced NPK fertilizer diluted to half strength. Avoid over-fertilizing to prevent leaf burn.
Dracaena fragrans,Cultivation Techniques,"Propagated commonly through stem cuttings or tissue culture. Cuttings should be taken in spring or early summer. Take stem cuttings of about 5-10 cm in length, allow the cut end to dry for a day before planting in a moist propagation medium.","Take stem cuttings of about 5-10 cm in length, allow the cut end to dry for a day before planting in a moist propagation medium."
Dracaena fragrans,Growth Habit,"An evergreen shrub that can grow up to 6 meters tall in its natural habitat, typically smaller indoors.","An evergreen shrub that can grow up to 6 meters tall in its natural habitat, typically smaller indoors."
Dracaena fragrans,Pharmacological Properties,No specific pharmacological properties mentioned.,No specific pharmacological properties mentioned.
Dracaena fragrans,Edible Properties,Not commonly used as an edible plant.,Not commonly used as an edible plant.
Dracaena fragrans,Benefits,"Known for its air-purifying qualities, making it a popular indoor plant.","Known for its air-purifying qualities, making it a popular indoor plant."
Dracaena fragrans,Seasonal Variations,Prefers warm conditions; not cold-hardy and should be protected from frost. Ideal temperatures range between 18-25掳C. Maintain indoor temperatures within the ideal range using heating in winter if necessary.,Maintain indoor temperatures within the ideal range using heating in winter if necessary.
Dracaena fragrans,Pests and Diseases,Susceptible to pests like spider mites and mealybugs. Regularly inspect for signs of infestation and treat with appropriate pesticides.,Regularly inspect for signs of infestation and treat with appropriate pesticides.
Dracaena fragrans,Control Methods,Avoid waterlogging to prevent root rot. Ensure proper air circulation around the plant.,Ensure proper air circulation around the plant.
Camellia oleifera,Growth Habit,"Evergreen small tree, height 3-6 m, prefers cold and wet climate, not tolerant of high temperatures. Plant in well-draining, enriched soil at a sunny to partly shaded location.","Plant in well-draining, enriched soil at a sunny to partly shaded location."
Camellia oleifera,Soil Requirements,"Prefers moist, well-drained sandy soil with high organic content, tolerates a wide pH range but prefers slightly acidic conditions. Use a well-draining potting mix with added perlite or sand to enhance drainage.",Use a well-draining potting mix with added perlite or sand to enhance drainage.
Camellia oleifera,Water Requirements,"Requires consistent moisture, especially during dry periods, without waterlogging. Water regularly to maintain moist soil, particularly in dry weather, reducing frequency in winter.","Water regularly to maintain moist soil, particularly in dry weather, reducing frequency in winter."
Camellia oleifera,Light Conditions,Prefers partial to full sunlight exposure; can tolerate some shade but performs best in well-lit environments. Provide partial shade during the hottest part of the day in summer to prevent leaf burn.,Provide partial shade during the hottest part of the day in summer to prevent leaf burn.
Camellia oleifera,Fertilization Requirements,Requires regular fertilization with a focus on phosphorus and potassium to support flowering and oil production. Apply a slow-release fertilizer in early spring and again in mid-summer.,Apply a slow-release fertilizer in early spring and again in mid-summer.
Camellia oleifera,Seasonal Variations,Flourishes in cooler temperatures; growth slows or stops in high temperatures or frost conditions. Protect from frost by mulching or using frost cloths; decrease watering in the winter.,Protect from frost by mulching or using frost cloths; decrease watering in the winter.
Camellia oleifera,Pests and Diseases,"Susceptible to pests like scale insects and camellia aphids, and diseases such as camellia root rot and leaf gall. Regularly inspect for pests and treat with appropriate organic pesticides if necessary.",Regularly inspect for pests and treat with appropriate organic pesticides if necessary.
Camellia oleifera,Control Methods,Prone to fungal diseases such as root rot; preventive care includes good hygiene and avoiding waterlogged conditions. Ensure good air circulation around plants and treat preventively with fungicides if conditions for fungal growth are present.,Ensure good air circulation around plants and treat preventively with fungicides if conditions for fungal growth are present.
Camellia oleifera,Description,An evergreen tree known for its oil-rich seeds and beautiful flowers.,An evergreen tree known for its oil-rich seeds and beautiful flowers.
Camellia oleifera,Benefits,Produces oil-rich seeds used in cooking and cosmetics; ornamental value for gardens.,Produces oil-rich seeds used in cooking and cosmetics; ornamental value for gardens.
Camellia oleifera,Pharmacological Properties,Contains compounds beneficial for skin health; oil extracted from seeds is used in skincare products.,Contains compounds beneficial for skin health; oil extracted from seeds is used in skincare products.
Camellia oleifera,Edible Properties,Seeds are edible and used to produce cooking oil.,Seeds are edible and used to produce cooking oil.
Camellia oleifera,Cultivation Techniques,"Plant in well-draining, enriched soil; prune regularly to maintain shape and remove diseased branches.","Plant in well-draining, enriched soil; prune regularly to maintain shape and remove diseased branches."
Ficus religiosa,Growth Habit,"Tree, grows up to 25 meters; gray bark; young branches with star-shaped hairs; leaves ovate, toothed margins. Prune to maintain shape and remove damaged branches. Supports wide spreading branches, forming a broad canopy.","Prune to maintain shape and remove damaged branches. Supports wide spreading branches, forming a broad canopy."
Ficus religiosa,Soil Requirements,"Prefers fertile, loose, well-draining sandy loam soil with slight acidity but is adaptable; does not tolerate waterlogging. Test soil pH and adjust if necessary to match plant preferences; use mulch to retain soil moisture.",Test soil pH and adjust if necessary to match plant preferences; use mulch to retain soil moisture.
Ficus religiosa,Water Requirements,"Needs ample moisture, particularly in dry conditions; avoid over-watering which can lead to root rot. Water deeply but infrequently to encourage deep root growth; adjust watering based on seasonal temperatures.",Water deeply but infrequently to encourage deep root growth; adjust watering based on seasonal temperatures.
Ficus religiosa,Light Conditions,"Requires full sunlight; tolerates high temperatures but not frost, minimum winter temperature of about 12掳C. Plant in a location that receives direct sunlight for at least 6-8 hours a day.",Plant in a location that receives direct sunlight for at least 6-8 hours a day.
Ficus religiosa,Fertilization Requirements,Fertilize sparingly with a balanced fertilizer; avoid over-fertilization which can harm the plant. Apply a balanced slow-release fertilizer during the growing season; reduce feeding in the dormant season.,Apply a balanced slow-release fertilizer during the growing season; reduce feeding in the dormant season.
Ficus religiosa,Pests and Diseases,Susceptible to leaf spot and anthracnose; use fungicidal sprays for prevention and treatment. Aphids and moth larvae can attack young shoots and leaves. Regularly inspect plants for signs of disease or pests; apply organic or chemical treatments as needed.,Regularly inspect plants for signs of disease or pests; apply organic or chemical treatments as needed.
Ficus religiosa,Cultivation Techniques,"Propagated mainly by cuttings and air layering; seeds can be used but are less common due to slower growth rates. Use hardwood cuttings in late winter or early spring; ensure cuttings are from healthy, disease-free plants.","Use hardwood cuttings in late winter or early spring; ensure cuttings are from healthy, disease-free plants."
Ficus religiosa,Description,"Known as the 'Bodhi tree' under which Siddhartha Gautama, the Buddha, attained enlightenment. Highly revered in Buddhist traditions and often planted in temple grounds. Plant in areas of cultural significance or incorporate into spiritual garden designs for added symbolic value.",Plant in areas of cultural significance or incorporate into spiritual garden designs for added symbolic value.
Ficus religiosa,Benefits,Provides shade and is used for its aesthetic and cultural significance in gardens and public spaces.,Provides shade and is used for its aesthetic and cultural significance in gardens and public spaces.
Ficus religiosa,Pharmacological Properties,Used in traditional medicine for treating various ailments; leaves and bark have medicinal properties.,Used in traditional medicine for treating various ailments; leaves and bark have medicinal properties.
Ficus religiosa,Edible Properties,Fruits are edible but not commonly consumed.,Fruits are edible but not commonly consumed.
Ficus religiosa,Seasonal Variations,Growth slows in colder months; protect from frost. Prefers warm and humid conditions during the growing season.,Growth slows in colder months; protect from frost. Prefers warm and humid conditions during the growing season.
Ficus religiosa,Control Methods,Apply organic or chemical treatments as needed; ensure good air circulation and avoid waterlogging.,Apply organic or chemical treatments as needed; ensure good air circulation and avoid waterlogging.
Mimosa pudica,Growth Habit,"Scrambling, sub-shrub herbaceous plant, up to 1 meter tall; cylindrical stems with branches; sparsely hook-spiked. Trim regularly to maintain health and manage size. Remove diseased or damaged branches to encourage growth.",Trim regularly to maintain health and manage size. Remove diseased or damaged branches to encourage growth.
Mimosa pudica,Soil Requirements,"Prefers warm, moist, and well-lit environments; thrives in well-drained, organic-rich, sandy loam soils. Conduct soil tests to adjust pH levels if necessary; use organic mulches to help retain soil moisture.",Conduct soil tests to adjust pH levels if necessary; use organic mulches to help retain soil moisture.
Mimosa pudica,Water Requirements,"Requires consistent moisture, especially in dry conditions; sensitive to waterlogging. Water deeply to encourage root growth; reduce watering in the cold season to prevent root rot.",Water deeply to encourage root growth; reduce watering in the cold season to prevent root rot.
Mimosa pudica,Light Conditions,Loves full sunlight but can tolerate partial shade; not frost-tolerant. Plant in an area with ample sunlight for best growth; use shade cloths in peak summer to prevent scorching.,Plant in an area with ample sunlight for best growth; use shade cloths in peak summer to prevent scorching.
Mimosa pudica,Fertilization Requirements,Moderate fertilization during the growing season; use balanced fertilizers to promote healthy growth. Apply a balanced NPK fertilizer every month during the growing season; avoid over-fertilization.,Apply a balanced NPK fertilizer every month during the growing season; avoid over-fertilization.
Mimosa pudica,Pests and Diseases,"Prone to pests like spider mites and aphids, and diseases such as leaf spot and rust; use appropriate pesticides and fungicides. Inspect regularly for signs of pests or disease; treat with eco-friendly pesticides or fungicides as needed.",Inspect regularly for signs of pests or disease; treat with eco-friendly pesticides or fungicides as needed.
Mimosa pudica,Cultivation Techniques,Propagated primarily through seeds; direct sowing is recommended to avoid transplant shock. Best sown directly where they are to grow in the spring; handle seedlings with care if transplanting.,Best sown directly where they are to grow in the spring; handle seedlings with care if transplanting.
Mimosa pudica,Description,"Used medicinally for its sedative properties; also valued for its rapid leaf-folding response to touch, used culturally in many regions for educational and ornamental purposes. Cultivate in garden beds or containers with adequate drainage; can be used in education for plant behavior demonstrations.",Cultivate in garden beds or containers with adequate drainage; can be used in education for plant behavior demonstrations.
Mimosa pudica,Benefits,Ornamental value due to its unique leaf-folding behavior; used in educational demonstrations.,Ornamental value due to its unique leaf-folding behavior; used in educational demonstrations.
Mimosa pudica,Pharmacological Properties,"Contains compounds with sedative properties, used in traditional medicine.","Contains compounds with sedative properties, used in traditional medicine."
Mimosa pudica,Edible Properties,Not commonly consumed but has some traditional medicinal uses.,Not commonly consumed but has some traditional medicinal uses.
Mimosa pudica,Seasonal Variations,Growth slows in cooler months; protect from frost. Prefers warm and humid conditions during the growing season.,Growth slows in cooler months; protect from frost. Prefers warm and humid conditions during the growing season.
Mimosa pudica,Control Methods,Apply eco-friendly pesticides or fungicides as needed; ensure good air circulation and proper watering practices.,Apply eco-friendly pesticides or fungicides as needed; ensure good air circulation and proper watering practices.
Asparagus setaceus,Growth Habit,"Scrambling climber, roots slightly fleshy, branches many and nearly smooth. White flowers on short pedicels; berries mature to a purple-black color. Regular pruning to maintain shape and health, especially in the dormant season to prepare for growth spurts.","Regular pruning to maintain shape and health, especially in the dormant season to prepare for growth spurts."
Asparagus setaceus,Soil Requirements,"Prefers warm, moist, semi-shaded environments; does not tolerate direct sunlight or frost. Best grown in loose, fertile, well-drained soil rich in organic matter. Ensure soil pH is slightly acidic to neutral. Use mulches to retain moisture and regulate soil temperature.",Ensure soil pH is slightly acidic to neutral. Use mulches to retain moisture and regulate soil temperature.
Asparagus setaceus,Water Requirements,"Requires moderate watering, ensuring soil remains moist but not waterlogged. Sensitive to overwatering which can lead to root rot. Water deeply rather than frequently, allowing the topsoil to dry out slightly between watering sessions.","Water deeply rather than frequently, allowing the topsoil to dry out slightly between watering sessions."
Asparagus setaceus,Light Conditions,"Prefers bright, indirect light or partial shade. Direct sunlight, especially in summer, can scorch the leaves. Provide shading during the hottest parts of the day in summer and ensure good lighting during winter to avoid etiolation.",Provide shading during the hottest parts of the day in summer and ensure good lighting during winter to avoid etiolation.
Asparagus setaceus,Fertilization Requirements,"Light fertilization needed, particularly during the growing season. Use balanced fertilizers to avoid over-fertilization, which can harm plant health. Apply a diluted, balanced liquid fertilizer monthly during the growing season. Reduce feeding in the winter.","Apply a diluted, balanced liquid fertilizer monthly during the growing season. Reduce feeding in the winter."
Asparagus setaceus,Pests and Diseases,"Susceptible to pests such as spider mites and mealybugs, and diseases like root rot. Use appropriate insecticides and maintain healthy cultural practices. Regularly inspect for signs of pests and disease. Treat with eco-friendly options as a first line of defense.",Regularly inspect for signs of pests and disease. Treat with eco-friendly options as a first line of defense.
Asparagus setaceus,Cultivation Techniques,"Propagated by seeds or division. Seed propagation is common, requiring stratification. Division is best done in spring or early summer. For seeds, maintain a consistent temperature of 20-25掳C for germination. For divisions, ensure each section has part of the root system.","For seeds, maintain a consistent temperature of 20-25掳C for germination. For divisions, ensure each section has part of the root system."
Asparagus setaceus,Description,"Used medicinally to treat coughs and colds due to its expectorant properties. Symbolizes purity and eternal love, commonly used in ornamental decorations in homes and offices. Consider placing in a study or office for a serene environment. Teachable moments in plant biology regarding plant response mechanisms.",Consider placing in a study or office for a serene environment. Teachable moments in plant biology regarding plant response mechanisms.
Asparagus setaceus,Benefits,"Ornamental value, adds aesthetic appeal to homes and offices. Used in floral arrangements and decorations.","Ornamental value, adds aesthetic appeal to homes and offices. Used in floral arrangements and decorations."
Asparagus setaceus,Pharmacological Properties,Contains compounds beneficial for treating respiratory issues. Used in traditional medicine for its expectorant properties.,Contains compounds beneficial for treating respiratory issues. Used in traditional medicine for its expectorant properties.
Asparagus setaceus,Edible Properties,Not commonly consumed as food but has some medicinal uses.,Not commonly consumed as food but has some medicinal uses.
Asparagus setaceus,Seasonal Variations,Growth slows in cooler months; prefers consistent temperatures. Protect from frost and cold drafts.,Growth slows in cooler months; prefers consistent temperatures. Protect from frost and cold drafts.
Asparagus setaceus,Control Methods,Regularly inspect for pests and disease. Use eco-friendly treatments and maintain proper cultural practices to prevent issues.,Regularly inspect for pests and disease. Use eco-friendly treatments and maintain proper cultural practices to prevent issues.
Cocos nucifera,Growth Habit,"Tall tree, typically 15-30 meters in height, with a sturdy trunk and ringed leaf scars. Leaves are feather-shaped and split into numerous linear-lanceolate segments. Prune to maintain shape and remove dead fronds. Regularly clear debris to prevent pest buildup.",Prune to maintain shape and remove dead fronds. Regularly clear debris to prevent pest buildup.
Cocos nucifera,Soil Requirements,Prefers well-drained sandy or loamy soils. Tolerates various soil types but flourishes in mineral-rich soils with good water retention capabilities. Add organic matter to enhance soil fertility and structure. Ensure adequate drainage to prevent waterlogging.,Add organic matter to enhance soil fertility and structure. Ensure adequate drainage to prevent waterlogging.
Cocos nucifera,Water Requirements,"Requires regular, deep watering to sustain its deep root system, especially in dry periods. Overwatering or poor drainage can lead to root rot. Water deeply to reach the deep root system, avoiding frequent shallow watering to encourage strong root growth.","Water deeply to reach the deep root system, avoiding frequent shallow watering to encourage strong root growth."
Cocos nucifera,Light Conditions,Thrives in full sunlight; tolerates partial shade but may lead to reduced growth and fruiting. Position in areas receiving direct sunlight for most of the day. Use shading techniques if necessary during peak summer months to prevent leaf burn.,Position in areas receiving direct sunlight for most of the day. Use shading techniques if necessary during peak summer months to prevent leaf burn.
Cocos nucifera,Fertilization Requirements,"High demand for potassium; moderate need for nitrogen and phosphorus. Regular applications of palm-specific or complete fertilizers enhance growth and fruit production. Apply slow-release palm fertilizers around the base of the tree, avoiding the trunk. Supplement with foliar feeds to address micronutrient deficiencies.","Apply slow-release palm fertilizers around the base of the tree, avoiding the trunk. Supplement with foliar feeds to address micronutrient deficiencies."
Cocos nucifera,Pests and Diseases,"Susceptible to pests like the coconut rhinoceros beetle and diseases such as lethal yellowing. Management includes sanitary practices and appropriate pesticide applications. Implement integrated pest management (IPM) strategies, monitor for signs of pests and diseases, and apply organic or chemical treatments as needed.","Implement integrated pest management (IPM) strategies, monitor for signs of pests and diseases, and apply organic or chemical treatments as needed."
Cocos nucifera,Cultivation Techniques,"Primarily propagated through seeds. Selected mature fruits are used for germination, ensuring genetic qualities are preserved. Follow a structured nursery protocol for germination and seedling development, including temperature control and initial shading.","Follow a structured nursery protocol for germination and seedling development, including temperature control and initial shading."
