Species,Aspect,Information,Measure
Nymphaea,Seasonal Variations,"Water lilies grow best in temperatures between 5-30掳C. They bloom in summer and go dormant in winter. For overwintering, place them in a cool room around 3掳C and keep the soil moist but not frozen.","Maintain temperatures between 5-30掳C. For overwintering, keep the soil moist but not frozen."
Nymphaea,Description,"Water lilies are perennial aquatic plants with rounded, floating leaves and star-shaped flowers. They symbolize purity and are often used in decorative ponds.","Water lilies are perennial aquatic plants with rounded, floating leaves and star-shaped flowers. They symbolize purity and are often used in decorative ponds."
Nymphaea,Benefits,Water lilies are known for their aesthetic and decorative value in ponds and water gardens.,Water lilies are known for their aesthetic and decorative value in ponds and water gardens.
Nymphaea,Pharmacological Properties,No specific pharmacological properties mentioned.,Use under the guidance of a healthcare professional.
Nymphaea,Edible Properties,Not applicable.,Not applicable.
Nymphaea,Cultivation Techniques,Water lilies grow through rhizomes. Divide the rhizomes in early spring or propagate through seeds.,Water lilies grow through rhizomes. Divide the rhizomes in early spring or propagate through seeds.
Aloe,Growth Habit,"Aloe is a succulent plant with thick, fleshy leaves that store water. It has a rosette growth habit and produces tall spikes of tubular flowers.",Aloe grows from offsets or seeds. Propagate by dividing offsets or sowing seeds in well-draining soil.
Aloe,Soil Requirements,"Aloe prefers well-draining, sandy or loamy soil. It thrives in a mix of garden soil, sand, and organic matter in a ratio of 4:4:2. The soil should be slightly acidic to neutral.","Plant Aloe in well-draining, sandy or loamy soil mixed with organic matter. Use a pot with drainage holes."
Aloe,Water Requirements,"Aloe needs moderate watering. Keep the soil moist but not waterlogged, as it is drought-tolerant but sensitive to waterlogging.",Water Aloe when the top inch of soil is dry. Avoid overwatering and ensure proper drainage.
Aloe,Light Conditions,"Aloe requires ample sunlight but can tolerate partial shade. It prefers bright, indirect sunlight and thrives best with 6-8 hours of sunlight daily.","Place Aloe in bright, indirect sunlight. Provide at least 6 hours of sunlight daily for best growth."
Aloe,Pests and Diseases,"Aloe can be affected by aphids, mealybugs, and scale insects. Regularly inspect the plant for pests and use insecticidal soap or neem oil as needed.",Inspect Aloe for pests regularly and treat with insecticidal soap or neem oil as needed.
Aloe,Control Methods,Inspect Aloe for pests regularly and treat with insecticidal soap or neem oil as needed.,Prevent root rot and leaf blight by avoiding overwatering and ensuring good drainage.
Aloe,Fertilization Requirements,"Aloe benefits from organic fertilizers, such as fermented plant-based fertilizers or diluted chemical fertilizers. Fertilize monthly during the growing season.",Fertilize Aloe monthly during the growing season with diluted organic or chemical fertilizers.
Aloe,Seasonal Variations,Aloe grows actively in warm temperatures and goes dormant in cooler temperatures. It is hardy and can tolerate temperatures as low as 3掳C.,Protect Aloe from temperatures below 3掳C. Bring it indoors during cold weather.
Aloe,Description,"Aloe is a succulent plant with thick, fleshy leaves that store water. It has a rosette growth habit and produces tall spikes of tubular flowers.","Aloe is a succulent plant with thick, fleshy leaves that store water. It has a rosette growth habit and produces tall spikes of tubular flowers."
Aloe,Benefits,"Aloe is known for its medicinal properties, particularly its soothing and healing effects on burns and skin irritations.","Aloe is known for its medicinal properties, particularly its soothing and healing effects on burns and skin irritations."
Aloe,Pharmacological Properties,"Aloe contains compounds with anti-inflammatory, antibacterial, and antiviral properties, making it useful for various medicinal purposes.",Use under the guidance of a healthcare professional.
Aloe,Edible Properties,Aloe gel is edible and often used in beverages and food products for its health benefits.,Aloe gel is edible and often used in beverages and food products for its health benefits.
Aloe,Cultivation Techniques,Aloe grows from offsets or seeds. Propagate by dividing offsets or sowing seeds in well-draining soil.,Aloe grows from offsets or seeds. Propagate by dividing offsets or sowing seeds in well-draining soil.
Bryophyllum,Growth Habit,"Bryophyllum is a succulent plant with fleshy, scalloped leaves that bear small plantlets along the edges. It's a fast-growing plant that thrives in warm conditions.",Bryophyllum grows from plantlets on the edges of its leaves. Propagate by placing the plantlets on the soil surface.
Bryophyllum,Soil Requirements,"Bryophyllum prefers well-draining, sandy, or gritty soil. It's best to use a mix of sandy soil and organic compost, with a ratio of about 2:1 for optimal growth.","Plant Bryophyllum in well-draining, sandy or gritty soil mixed with organic matter."
Bryophyllum,Water Requirements,"Bryophyllum requires moderate watering. Allow the soil to dry out completely between watering, as the plant is drought-tolerant but sensitive to overwatering.",Water Bryophyllum when the soil is dry and avoid overwatering to prevent root rot.
Bryophyllum,Light Conditions,"Bryophyllum prefers bright, indirect sunlight but can tolerate partial shade. It thrives best with 6-8 hours of sunlight daily. During summer, some shade is beneficial to prevent leaf burn.","Place Bryophyllum in bright, indirect sunlight. Provide at least 6 hours of sunlight daily for best growth."
Bryophyllum,Pests and Diseases,Bryophyllum is generally pest-free but can be affected by aphids and mealybugs.,Inspect Bryophyllum for pests regularly and treat with insecticidal soap or neem oil as needed.
Bryophyllum,Control Methods,Inspect Bryophyllum for pests regularly and treat with insecticidal soap or neem oil as needed.,Prevent root rot by avoiding overwatering and ensuring good drainage.
Bryophyllum,Fertilization Requirements,Bryophyllum does not require frequent fertilization. Use a balanced liquid fertilizer diluted to half-strength every 2-3 weeks during the growing season.,Fertilize Bryophyllum every 2-3 weeks during the growing season with diluted balanced liquid fertilizer.
Bryophyllum,Seasonal Variations,Bryophyllum grows best in temperatures between 15-30掳C. It is not frost-tolerant and should be protected from temperatures below 5掳C.,Protect Bryophyllum from temperatures below 5掳C. Bring it indoors during cold weather.
Bryophyllum,Description,"Bryophyllum is a succulent plant with fleshy, scalloped leaves that bear small plantlets along the edges. It's a fast-growing plant that thrives in warm conditions.","Bryophyllum is a succulent plant with fleshy, scalloped leaves that bear small plantlets along the edges. It's a fast-growing plant that thrives in warm conditions."
Bryophyllum,Benefits,"Bryophyllum is known for its medicinal properties, particularly its ability to heal wounds and treat infections.","Bryophyllum is known for its medicinal properties, particularly its ability to heal wounds and treat infections."
Bryophyllum,Pharmacological Properties,"Bryophyllum contains compounds that have anti-inflammatory and antibacterial properties, making it useful for various medicinal purposes.",Use under the guidance of a healthcare professional.
Bryophyllum,Edible Properties,No known edible properties.,Not applicable.
Bryophyllum,Cultivation Techniques,Bryophyllum grows from plantlets on the edges of its leaves. Propagate by placing the plantlets on the soil surface.,Bryophyllum grows from plantlets on the edges of its leaves. Propagate by placing the plantlets on the soil surface.
Zebrina pendula,Growth Habit,"Zebrina pendula is a succulent plant with fleshy, scalloped leaves that bear small plantlets along the edges. It's a fast-growing plant that thrives in warm conditions.",Zebrina pendula grows from plantlets on the edges of its leaves. Propagate by placing the plantlets on the soil surface.
Zebrina pendula,Soil Requirements,"Zebrina pendula prefers well-draining, sandy, or gritty soil. It's best to use a mix of sandy soil and organic compost, with a ratio of about 2:1 for optimal growth.","Plant Zebrina pendula in well-draining, sandy or gritty soil mixed with organic matter."
Zebrina pendula,Water Requirements,"Zebrina pendula requires moderate watering. Allow the soil to dry out completely between watering, as the plant is drought-tolerant but sensitive to overwatering.",Water Zebrina pendula when the soil is dry and avoid overwatering to prevent root rot.
Zebrina pendula,Light Conditions,"Zebrina pendula prefers bright, indirect sunlight but can tolerate partial shade. It thrives best with 6-8 hours of sunlight daily. During summer, some shade is beneficial to prevent leaf burn.","Place Zebrina pendula in bright, indirect sunlight. Provide at least 6 hours of sunlight daily for best growth."
Zebrina pendula,Pests and Diseases,Zebrina pendula is generally pest-free but can be affected by aphids and mealybugs.,Inspect Zebrina pendula for pests regularly and treat with insecticidal soap or neem oil as needed.
Zebrina pendula,Control Methods,Inspect Zebrina pendula for pests regularly and treat with insecticidal soap or neem oil as needed.,Prevent root rot by avoiding overwatering and ensuring good drainage.
Zebrina pendula,Fertilization Requirements,Zebrina pendula does not require frequent fertilization. Use a balanced liquid fertilizer diluted to half-strength every 2-3 weeks during the growing season.,Fertilize Zebrina pendula every 2-3 weeks during the growing season with diluted balanced liquid fertilizer.
Zebrina pendula,Seasonal Variations,Zebrina pendula grows best in temperatures between 15-30掳C. It is not frost-tolerant and should be protected from temperatures below 5掳C.,Protect Zebrina pendula from temperatures below 5掳C. Bring it indoors during cold weather.
Zebrina pendula,Description,"Zebrina pendula is a succulent plant with fleshy, scalloped leaves that bear small plantlets along the edges. It's a fast-growing plant that thrives in warm conditions.","Zebrina pendula is a succulent plant with fleshy, scalloped leaves that bear small plantlets along the edges. It's a fast-growing plant that thrives in warm conditions."
Zebrina pendula,Benefits,Zebrina pendula is known for its ornamental value and ease of care.,Zebrina pendula is known for its ornamental value and ease of care.
Zebrina pendula,Pharmacological Properties,No specific pharmacological properties mentioned.,Use under the guidance of a healthcare professional.
Zebrina pendula,Edible Properties,Not applicable.,Not applicable.
Zebrina pendula,Cultivation Techniques,Zebrina pendula grows from plantlets on the edges of its leaves. Propagate by placing the plantlets on the soil surface.,Zebrina pendula grows from plantlets on the edges of its leaves. Propagate by placing the plantlets on the soil surface.
Campanula medium,Growth Habit,"An evergreen biennial growing up to 1.2 meters (4 feet) tall and 0.3 meters (1 foot) wide. The species blooms in July, featuring bell-shaped flowers, and produces seeds from August to September. It is hermaphrodite, self-fertile, and pollinated by bees, flies, beetles, and moths.","Upright growth habit, medium rate."
Campanula medium,Soil Requirements,"Prefers fertile, well-drained soil, ideally rich sandy loam. The plant tolerates neutral to alkaline soils and can grow in very alkaline conditions.","Plant in moist but well-drained soil, neutral to alkaline pH."
Campanula medium,Water Requirements,Prefers moist soil but should avoid being waterlogged. The plant is frost-hardy.,Water regularly but avoid excessive moisture.
Campanula medium,Light Conditions,"Thrives in full sun to partial shade, suitable for light woodland or direct sunlight. The plant is hardy in UK zone 8.",Provide partial shade or full sun.
Campanula medium,Pests and Diseases,"Generally disease-free, but may occasionally suffer from slugs and snails. The plant is rarely troubled by deer.",Monitor for pests and use organic repellents or barriers if necessary.
Campanula medium,Control Methods,Avoid excessive moisture and maintain good air circulation to prevent fungal issues.,Use barriers or repellents against slugs and snails if needed.
Campanula medium,Fertilization Requirements,"Requires moderate fertilization, especially in sandy soils. The plant often self-sows in British gardens.","Apply balanced fertilizer during active growth, typically monthly."
Campanula medium,Seasonal Variations,"Blooms from early to late summer, with flowering typically peaking in July. The leaves remain evergreen.",Monitor for flowering in summer and seed ripening in late summer.
Campanula medium,Description,"Known for its ornamental value and bell-shaped flowers. It is often used in borders, containers, and as ground cover.","Grow in borders or containers, suitable for cut flowers."
Campanula medium,Benefits,"Ornamental value, attracts pollinators.","Ornamental value, attracts pollinators."
Campanula medium,Pharmacological Properties,No specific pharmacological properties mentioned.,Use under the guidance of a healthcare professional.
Campanula medium,Edible Properties,No known edible properties.,Not applicable.
Campanula medium,Cultivation Techniques,Use barriers or repellents against slugs and snails if needed.,Use barriers or repellents against slugs and snails if needed.
Jasminum sambac,Growth Habit,"A woody shrub or climber growing up to 3 meters (9 feet) tall, with cylindrical stems. The leaves are opposite, round, or oval-shaped. The flowers are white and fragrant, blooming from May to August. The fruit is spherical and dark brown, ripening from July to September.","Woody shrub or climber, up to 3 meters tall."
Jasminum sambac,Soil Requirements,"Prefers fertile, well-drained soil with lots of organic matter. The soil should be slightly acidic and sandy.","Fertile, well-drained, slightly acidic, sandy soil."
Jasminum sambac,Water Requirements,"Prefers moist conditions but dislikes waterlogging. It needs a warm, humid environment.","Moist but not waterlogged, warm, and humid."
Jasminum sambac,Light Conditions,Thrives in full sun to partial shade. It prefers good ventilation and semi-shade conditions.,"Full sun to partial shade, well-ventilated."
Jasminum sambac,Pests and Diseases,"Susceptible to white silk disease, anthracnose, leaf spot, and soot disease.",Control with fungicides or insecticides.
Jasminum sambac,Control Methods,Control with fungicides or insecticides.,"Use appropriate controls, ensure good ventilation."
Jasminum sambac,Fertilization Requirements,"Requires regular fertilization, particularly phosphorus-rich fertilizer during the blooming season.","Regular fertilization, particularly phosphorus-rich."
Jasminum sambac,Seasonal Variations,Flowers from May to August and fruits from July to September. Prune after flowering to promote new growth.,"Flowering in summer, prune after blooming."
Jasminum sambac,Description,Known for its fragrant white flowers. Used in perfumes and teas.,"Fragrant flowers, used in perfumes and teas."
Jasminum sambac,Benefits,"Fragrant flowers, used in perfumes and teas.","Edible flowers, used in tea and desserts."
Jasminum sambac,Pharmacological Properties,"The plant has anesthetic, antiasthmatic, antipyretic, and astringent properties. The leaves are used for catarrh, bronchitis, and asthma.",Use under the guidance of a healthcare professional.
Jasminum sambac,Edible Properties,The flowers are edible and used to scent tea. Aromatic water from the flowers is popular in Thai desserts.,"Edible flowers, used in tea and desserts."
Jasminum sambac,Cultivation Techniques,"Use appropriate controls, ensure good ventilation.","Use appropriate controls, ensure good ventilation."
Gardenia jasminoides,Growth Habit,Shrub growing 0.3-6 meters tall.,Grows up to 6 meters tall.
Gardenia jasminoides,Soil Requirements,"Prefers loose, fertile, well-drained, humus-rich, slightly acidic soil.","Plant in well-drained, slightly acidic soil."
Gardenia jasminoides,Water Requirements,"Moderate watering needs, prefers moist soil, dislikes waterlogging.","Water moderately, avoid waterlogging, keep soil moist."
Gardenia jasminoides,Light Conditions,"Young plants need shade, mature plants prefer full sun to partial shade.","Provide shade for young plants, full sun or partial shade for mature plants."
Gardenia jasminoides,Pests and Diseases,"Susceptible to yellowing leaves due to nutrient deficiencies, and attacks by scale insects, but generally no major pest or disease issues.","Treat nutrient deficiencies, manage scale insects, monitor for issues."
Gardenia jasminoides,Control Methods,"Treat nutrient deficiencies, manage scale insects, monitor for issues.","Apply sulfur or iron chelates for yellowing leaves, use insecticidal soap for scale insects, monitor regularly."
Gardenia jasminoides,Fertilization Requirements,"Likes regular fertilization with balanced fertilizer, but does well with occasional feeding.","Fertilize regularly with balanced fertilizer, feed occasionally."
Gardenia jasminoides,Seasonal Variations,"Blooms from May to August, fruits from June to February, evergreen.","Expect blooms from May to August, fruits from June to February, remains evergreen."
Gardenia jasminoides,Description,Known for its fragrant white flowers and glossy green leaves. Often used in gardens and as a houseplant.,"Fragrant flowers, ornamental value."
Gardenia jasminoides,Benefits,"Fragrant flowers, ornamental value.","Fragrant flowers, ornamental value."
Gardenia jasminoides,Pharmacological Properties,No specific pharmacological properties mentioned.,Use under the guidance of a healthcare professional.
Gardenia jasminoides,Edible Properties,No known edible properties.,Not applicable.
Gardenia jasminoides,Cultivation Techniques,"Use sulfur or iron chelates for yellowing leaves, apply insecticidal soap for scale insects, monitor regularly.","Apply sulfur or iron chelates for yellowing leaves, use insecticidal soap for scale insects, monitor regularly."
Opuntia dillenii,Growth Habit,Evergreen perennial growing to 1 meter by 1 meter.,Grows to 1 meter tall and wide.
Opuntia dillenii,Soil Requirements,"Prefers well-drained sandy or loamy soil, can grow in nutritionally poor soil.",Plant in well-drained sandy or loamy soil.
Opuntia dillenii,Water Requirements,"Prefers dry or moist soil, can tolerate drought.","Provide dry or moist soil, can tolerate drought."
Opuntia dillenii,Light Conditions,Requires full sun.,Plant in full sun.
Opuntia dillenii,Pests and Diseases,Has numerous minutely barbed glochids that cause discomfort when touched.,Avoid contact with glochids to prevent discomfort.
Opuntia dillenii,Control Methods,"Has weed potential, no major diseases known.",Monitor for weed-like growth.
Opuntia dillenii,Fertilization Requirements,"No special fertilization requirements, grows well in poor soils.",No special fertilization required.
Opuntia dillenii,Seasonal Variations,"Blooms from March to May, fruits from June to October.","Blooms in spring, fruits in summer and fall."
Opuntia dillenii,Description,Used as fencing or fodder.,Use as fencing or fodder.
Opuntia dillenii,Benefits,"Used as fencing, fodder, and ornamental plant.","Used as fencing, fodder, and ornamental plant."
Opuntia dillenii,Pharmacological Properties,No specific pharmacological properties mentioned.,Use under the guidance of a healthcare professional.
Opuntia dillenii,Edible Properties,No known edible properties.,Not applicable.
Opuntia dillenii,Cultivation Techniques,Monitor for weed-like growth.,Monitor for weed-like growth.
Sansevieria trifasciata,Growth Habit,Evergreen perennial growing up to 0.8 meters.,Grows up to 0.8 meters tall.
Sansevieria trifasciata,Soil Requirements,"Prefers well-drained soil, can grow in heavy clay and nutritionally poor soils.","Plant in well-drained soil, tolerates clay and poor soils."
Sansevieria trifasciata,Water Requirements,"Prefers dry or moist soil, can tolerate drought.","Provide dry or moist soil, tolerates drought."
Sansevieria trifasciata,Light Conditions,Grows in semi-shade or full sun.,Provide semi-shade or full sun.
Sansevieria trifasciata,Pests and Diseases,"Prone to bacterial soft rot, leaf spot, anthracnose, and scales.","Monitor for bacterial soft rot, leaf spot, anthracnose, and scales."
Sansevieria trifasciata,Control Methods,"Use bactericides for bacterial infections, fungicides for leaf spot and anthracnose, and insecticides for scales.",Apply appropriate treatments based on infection type.
Sansevieria trifasciata,Fertilization Requirements,"No special fertilization requirements, prefers balanced fertilizer.","Use balanced fertilizer, no special requirements."
Sansevieria trifasciata,Seasonal Variations,Blooms from November to December.,Expect blooms from November to December.
Sansevieria trifasciata,Description,"Known for its air-purifying qualities, fiber production, and ornamental value.","Use for air purification, fiber production, or as an ornamental plant."
Sansevieria trifasciata,Benefits,"Air purification, fiber production, ornamental value.","Use for air purification, fiber production, or as an ornamental plant."
Sansevieria trifasciata,Pharmacological Properties,No specific pharmacological properties mentioned.,Use under the guidance of a healthcare professional.
Sansevieria trifasciata,Edible Properties,No known edible properties.,Not applicable.
Sansevieria trifasciata,Cultivation Techniques,Apply appropriate treatments based on infection type.,Apply appropriate treatments based on infection type.
Tagetes lucida,Growth Habit,Perennial growing up to 0.8 meters.,Grows up to 0.8 meters tall.
Tagetes lucida,Soil Requirements,"Prefers well-drained soil, can grow in heavy clay soil.","Plant in well-drained soil, tolerates heavy clay."
Tagetes lucida,Water Requirements,Prefers dry or moist soil.,Provide dry or moist soil.
Tagetes lucida,Light Conditions,Prefers full sun.,Plant in full sun.
Tagetes lucida,Pests and Diseases,"Prone to slugs, snails, and botrytis.","Monitor for slugs, snails, and botrytis."
Tagetes lucida,Control Methods,"Use appropriate treatments for slugs, snails, and botrytis.",Apply appropriate treatments based on pest or disease type.
Tagetes lucida,Fertilization Requirements,"No special fertilization requirements, grows well in moderately fertile soil.",No special fertilization required.
Tagetes lucida,Seasonal Variations,Blooms from August to September.,Expect blooms from August to September.
Tagetes lucida,Description,"Known for its use in companion planting, dye production, herbicide, incense, insecticide, and repellent properties.","Use for companion planting, dye, herbicide, incense, insecticide, or repellent."
Tagetes lucida,Benefits,"Companion planting, dye, herbicide, incense, insecticide, repellent.","Use for companion planting, dye, herbicide, incense, insecticide, or repellent."
Tagetes lucida,Pharmacological Properties,"Digestive, diuretic, febrifuge, hypotensive, sedative, stimulant, anaesthetic.","Use for digestive, diuretic, febrifuge, hypotensive, sedative, stimulant, or anaesthetic purposes."
Tagetes lucida,Edible Properties,"Leaves and flowers used as condiment or tea, anise-like flavor.",Use leaves and flowers as condiment or tea.
Tagetes lucida,Cultivation Techniques,"Apply appropriate treatments for slugs, snails, and botrytis.","Apply appropriate treatments for slugs, snails, and botrytis."
Papaver rhoeas,Growth Habit,"Annual herb, stems erect, 25-90 cm tall.","Annual, 25-90 cm tall."
Papaver rhoeas,Soil Requirements,Prefers well-drained sandy loam.,Prefers well-drained sandy loam.
Papaver rhoeas,Water Requirements,Prefers moist soil.,Prefers moist soil.
Papaver rhoeas,Light Conditions,Prefers full sun.,Prefers full sun.
Papaver rhoeas,Pests and Diseases,"Susceptible to damping-off, aphids.","Monitor for damping-off, aphids."
Papaver rhoeas,Control Methods,"Apply fungicide for damping-off, insecticide for aphids.",Apply appropriate treatments for specific pests or diseases.
Papaver rhoeas,Fertilization Requirements,"No specific fertilization requirements, grows well in fertile soil.",No specific fertilization required.
Papaver rhoeas,Seasonal Variations,"Blooms from June to August, seeds ripen from August to September.",Expect blooms from June to August.
Papaver rhoeas,Description,"Used for dye, ink, oil, pot-pourri.","Use for dye, ink, oil, pot-pourri."
Papaver rhoeas,Benefits,"Edible seeds and leaves, used in salads or for oil.",Use seeds and leaves in salads or for oil.
Papaver rhoeas,Pharmacological Properties,"Anodyne, sedative, expectorant, tonic.","Use for anodyne, sedative, expectorant, or tonic."
Papaver rhoeas,Edible Properties,Use seeds and leaves in salads or for oil.,Use seeds and leaves in salads or for oil.
Papaver rhoeas,Cultivation Techniques,Apply appropriate treatments for specific pests or diseases.,Apply appropriate treatments for specific pests or diseases.
Bambusa multiplex 'Fernleaf',Growth Habit,"Evergreen bamboo, grows up to 6 meters tall.","Evergreen, up to 6 meters tall."
Bambusa multiplex 'Fernleaf',Soil Requirements,"Prefers well-drained, fertile soil.","Prefers well-drained, fertile soil."
Bambusa multiplex 'Fernleaf',Water Requirements,"Prefers moist soil, avoid waterlogging.","Prefers moist soil, avoid waterlogging."
