Species,Aspect,Information,Measure
Bamboo,Growth Habit,"Perennial, evergreen, woody plants that can grow in diverse climates.",Use a pot with adequate drainage and a wide base for stability.
Bamboo,Soil Requirements,"Prefers loose, fertile, well-drained loamy soil; avoids heavy, wet clays.",Place a humidity tray under the pot to increase ambient moisture and mimic natural habitat.
Bamboo,Water Requirements,Requires consistent moisture but is sensitive to waterlogging; ensure good drainage.,"Use a soil mix of garden soil, perlite, and peat moss to ensure good drainage and moisture retention."
Bamboo,Light Conditions,Prefers bright light but tolerates partial shade; too little light can inhibit growth.,Place in a location where it can receive several hours of direct sunlight daily.
Bamboo,Pests and Diseases,Susceptible to pests like spider mites and diseases such as root rot if overwatered.,"Regularly check for pests and diseases, especially during warm, humid periods."
Bamboo,Control Methods,"Regularly check for pests and diseases, especially during warm, humid periods.",Prune regularly to encourage new growth and maintain desired shape and size.
Bamboo,Fertilization Requirements,Needs regular fertilization with balanced fertilizer during the growing season.,Fertilize monthly with a balanced liquid fertilizer during the growing season.
Bamboo,Seasonal Variations,Growth rate and leaf drop can vary with temperature; less vigorous in cooler temperatures.,Adjust watering based on the season; reduce in winter.
Bamboo,Description,"Known for its fast growth and versatility, used in construction, paper production, and as ornamental plants.","Known for its fast growth and versatility, used in construction, paper production, and as ornamental plants."
Bamboo,Benefits,"Used for construction, paper, furniture, and as a renewable resource.","Used for construction, paper, furniture, and as a renewable resource."
Bamboo,Pharmacological Properties,"Contains silica, which is believed to have medicinal properties for bone health.","Contains silica, which is believed to have medicinal properties for bone health."
Bamboo,Edible Properties,Young bamboo shoots are edible and used in various culinary dishes.,Young bamboo shoots are edible and used in various culinary dishes.
Bamboo,Cultivation Techniques,Use a pot with adequate drainage and a wide base for stability.,Use a pot with adequate drainage and a wide base for stability.
Hairy Vetch,Growth Habit,"Used as a winter cover crop, hardy and able to withstand cold.","Choose high-quality, disease-resistant seeds to ensure good germination and healthy plants."
Hairy Vetch,Soil Requirements,"Prefers fertile, moist, well-drained sandy loam soil.",Ensure the soil is well-aerated and free from weeds and stones prior to planting; integrate ample organic matter.
Hairy Vetch,Water Requirements,"Requires consistent moisture, not drought-tolerant, excessive dryness leads to early flowering.","Irrigate sufficiently to maintain moist soil conditions, especially during dry spells to prevent stress on plants."
Hairy Vetch,Light Conditions,"Tolerates a wide range of light conditions, but prolonged cloudy weather causes elongation.",Provide adequate natural light or supplementary lighting in darker conditions; avoid overly shaded areas.
Hairy Vetch,Pests and Diseases,"Generally hardy, but watch for common pests and manage accordingly.",Regularly inspect for pests and apply natural or chemical controls as needed; consider integrated pest management strategies.
Hairy Vetch,Control Methods,Regularly inspect for pests and apply natural or chemical controls as needed; consider integrated pest management strategies.,Practice crop rotation and use disease-free seeds; apply fungicides if necessary to control outbreaks.
Hairy Vetch,Fertilization Requirements,Responds well to regular nitrogen applications during the growing season to enhance leafy growth.,Apply nitrogen-rich fertilizers or manure during the early growth stages to promote robust vegetative growth.
Hairy Vetch,Seasonal Variations,"Can be planted three times a year; spring, autumn, and winter. In northern regions, best planted in spring.",Adjust planting schedules based on regional climate; protect plants from extreme weather conditions with mulch or cover.
Hairy Vetch,Description,"Used as a cover crop to improve soil fertility and structure, fix nitrogen, and suppress weeds.","Used as a cover crop to improve soil fertility and structure, fix nitrogen, and suppress weeds."
Hairy Vetch,Benefits,"Improves soil fertility and structure, used in crop rotation to enhance soil health.","Improves soil fertility and structure, used in crop rotation to enhance soil health."
Hairy Vetch,Pharmacological Properties,No specific pharmacological properties mentioned.,Use under the guidance of a healthcare professional.
Hairy Vetch,Edible Properties,No known edible properties.,Not applicable.
Hairy Vetch,Cultivation Techniques,"Choose high-quality, disease-resistant seeds to ensure good germination and healthy plants.","Choose high-quality, disease-resistant seeds to ensure good germination and healthy plants."
Hydrocotyle verticillata,Growth Habit,"Grows both in water and soil, prefers warm, humid environments, and tolerates shade.",Prune regularly to encourage dense growth and prevent legginess. Remove flowers to focus the plant's energy on foliage production.
Hydrocotyle verticillata,Soil Requirements,"Prefers loose, fertile, well-draining soil or can be grown hydroponically.","Use a pot with good drainage holes to prevent waterlogging. If growing in water, change water weekly to prevent stagnation."
Hydrocotyle verticillata,Water Requirements,Requires consistent moisture without waterlogging. Suitable for hydroponic growth as well.,Water to keep the soil consistently moist. Adjust watering frequency based on temperature and light 鈥?more in bright light and less in low light.
Hydrocotyle verticillata,Light Conditions,"Prefers partial sunlight; direct strong sunlight can scorch the leaves, while too little light can lead to etiolation.","Provide filtered sunlight, especially during the hot midday hours. If grown indoors, ensure bright, indirect light."
Hydrocotyle verticillata,Pests and Diseases,"General pest resistance is good; however, may occasionally suffer from aphids and spider mites.","Inspect regularly for pests, particularly under the leaves. Treat infestations early with suitable insecticidal soap or neem oil."
Hydrocotyle verticillata,Control Methods,"Inspect regularly for pests, particularly under the leaves. Treat infestations early with suitable insecticidal soap or neem oil.",Avoid overwatering to prevent root rot. Ensure good air circulation around the plant to help prevent fungal diseases.
Hydrocotyle verticillata,Fertilization Requirements,Responds well to regular feeding during growing season with balanced liquid fertilizers.,"Feed with a balanced, water-soluble fertilizer every two weeks during the growing season. Reduce feeding in winter if growth slows."
Hydrocotyle verticillata,Seasonal Variations,Grows year-round if conditions are favorable. Growth can stall in cold conditions.,Move the plant indoors or provide protection if temperatures are expected to drop below the plant's tolerance range.
Hydrocotyle verticillata,Description,Known for its rapid growth and ability to thrive in both aquatic and terrestrial environments.,Known for its rapid growth and ability to thrive in both aquatic and terrestrial environments.
Hydrocotyle verticillata,Benefits,Used as an ornamental plant for ground cover and in aquariums for its aesthetic appeal.,Used as an ornamental plant for ground cover and in aquariums for its aesthetic appeal.
Hydrocotyle verticillata,Pharmacological Properties,No specific pharmacological properties mentioned.,Use under the guidance of a healthcare professional.
Hydrocotyle verticillata,Edible Properties,Not commonly used as an edible plant.,Not applicable.
Hydrocotyle verticillata,Cultivation Techniques,Prune regularly to encourage dense growth and prevent legginess. Remove flowers to focus the plant's energy on foliage production.,Prune regularly to encourage dense growth and prevent legginess. Remove flowers to focus the plant's energy on foliage production.
Aglaonema commutatum cv. Silver Queen,Growth Habit,"Known for its beautiful, silvery leaves and shade tolerance. Thrives in indirect light and is known for its air-purifying qualities.",Prune to maintain shape and remove any yellowing leaves to encourage new growth.
Aglaonema commutatum cv. Silver Queen,Soil Requirements,"Prefers loose, peat-based soil with good drainage. Acidic soil is beneficial.",Use well-draining pots and soil to prevent water retention and root rot.
Aglaonema commutatum cv. Silver Queen,Water Requirements,"Requires even moisture, prefers high humidity, and should not be overwatered. Soil should be kept moist but not waterlogged.",Water when the top inch of soil feels dry to touch. Reduce watering frequency during winter months.
Aglaonema commutatum cv. Silver Queen,Light Conditions,"Thrives in filtered light; direct sunlight can cause leaf scorch, while too little light dulls leaf coloration.","Position in a location that receives bright, indirect sunlight. Use curtains or blinds to diffuse direct sunlight."
Aglaonema commutatum cv. Silver Queen,Pests and Diseases,Susceptible to pests like scale insects and mealybugs. Regular inspection and prompt treatment are recommended.,Treat pests and diseases with appropriate organic or chemical treatments as soon as they are detected.
Aglaonema commutatum cv. Silver Queen,Control Methods,Treat pests and diseases with appropriate organic or chemical treatments as soon as they are detected.,"Regularly check for signs of overwatering and underfeeding, and adjust care routines accordingly."
Aglaonema commutatum cv. Silver Queen,Fertilization Requirements,"Feed with a balanced, water-soluble fertilizer bi-monthly during the growing season. Reduce feeding in the winter.",Apply a balanced fertilizer every other month during active growth periods. Reduce feeding in dormant seasons.
Aglaonema commutatum cv. Silver Queen,Seasonal Variations,Prefers warm temperatures between 20-24掳C. Growth can slow or cease if temperatures drop below 10掳C or rise above 30掳C.,Monitor and adjust the plant's environment with the changing seasons to prevent stress and maintain health.
Aglaonema commutatum cv. Silver Queen,Description,"Known for its ornamental value and air-purifying qualities, making it a popular houseplant.","Known for its ornamental value and air-purifying qualities, making it a popular houseplant."
Aglaonema commutatum cv. Silver Queen,Benefits,Improves indoor air quality by removing toxins.,Improves indoor air quality by removing toxins.
Aglaonema commutatum cv. Silver Queen,Pharmacological Properties,No specific pharmacological properties mentioned.,Use under the guidance of a healthcare professional.
Aglaonema commutatum cv. Silver Queen,Edible Properties,Not commonly used as an edible plant.,Not applicable.
Aglaonema commutatum cv. Silver Queen,Cultivation Techniques,Prune to maintain shape and remove any yellowing leaves to encourage new growth.,Prune to maintain shape and remove any yellowing leaves to encourage new growth.
Black Rose,Growth Habit,"Rosa 'Noir' tends to have a bushy growth habit, thriving in well-drained garden beds or large pots.","Plant in a location that accommodates its size at maturity, ensuring enough space for air circulation."
Black Rose,Soil Requirements,"Prefers well-drained, fertile soil with a pH between 6.0 and 6.5.",Amend the planting site with compost and bone meal to enhance soil structure and fertility.
Black Rose,Water Requirements,"Requires regular watering, especially during dry periods, but must not be waterlogged.",Establish a watering routine that maintains consistent soil moisture but allows the soil to dry slightly between waterings.
Black Rose,Light Conditions,Needs full sun for optimal growth and bloom; at least 6 hours of direct sunlight daily.,"Position in a sunny area of the garden, avoiding shaded spots that can reduce flowering and increase disease risk."
Black Rose,Pests and Diseases,"Prone to pests such as aphids, spider mites, and fungal diseases like black spot and powdery mildew.",Regularly check for pests and apply organic or chemical treatments as needed to manage infestations.
Black Rose,Control Methods,Regularly check for pests and apply organic or chemical treatments as needed to manage infestations.,"Implement a disease management plan that includes resistant varieties, proper spacing, and fungicidal sprays if needed."
Black Rose,Fertilization Requirements,"Apply a balanced, slow-release fertilizer in early spring and a bloom booster before the flowering season.","Apply fertilizers according to package instructions, avoiding over-fertilization which can lead to poor bloom and weak growth."
Black Rose,Seasonal Variations,"Shows vigorous growth in spring and summer, may go dormant in winter in cold climates.","Mulch around the base to maintain soil temperature, conserve moisture, and suppress weeds."
Black Rose,Description,"Known for its unique dark blooms and high ornamental value, often used in gardens and floral arrangements.","Known for its unique dark blooms and high ornamental value, often used in gardens and floral arrangements."
Black Rose,Benefits,"Adds aesthetic value to gardens and landscapes, known for its striking appearance.","Adds aesthetic value to gardens and landscapes, known for its striking appearance."
Black Rose,Pharmacological Properties,No specific pharmacological properties mentioned.,Use under the guidance of a healthcare professional.
Black Rose,Edible Properties,Not commonly used as an edible plant.,Not applicable.
Black Rose,Cultivation Techniques,"Plant in a location that accommodates its size at maturity, ensuring enough space for air circulation.","Plant in a location that accommodates its size at maturity, ensuring enough space for air circulation."
Murraya exotica,Growth Habit,"Can grow as a small tree or large shrub, reaching heights of up to 8 meters. Beautiful posture with lush, fragrant flowers.",Plant in a location that provides adequate space for mature size. Ensure good air circulation.
Murraya exotica,Soil Requirements,"Prefers well-drained sandy soils, rich in organic matter. Performs best in sunlit areas.",Use a well-draining potting mix rich in organic matter. Consider adding perlite or sand to improve drainage.
Murraya exotica,Water Requirements,"Requires moderate watering, keeping the soil consistently moist but not waterlogged.",Water deeply when the top inch of soil feels dry to the touch. Reduce watering frequency during winter.
Murraya exotica,Light Conditions,Thrives in full sun to partial shade. Needs protection from direct sunlight in hotter climates to prevent scorching.,"Place in an area with partial shade to full sun, depending on local climate conditions."
Murraya exotica,Pests and Diseases,Susceptible to pests such as scale insects and fungal diseases like sooty mold due to honeydew excretion by pests.,Monitor plants regularly for pests and apply organic or chemical treatments as necessary.
Murraya exotica,Control Methods,Monitor plants regularly for pests and apply organic or chemical treatments as necessary.,Practice good sanitation by removing fallen leaves and debris to prevent disease spread.
Murraya exotica,Fertilization Requirements,Benefits from regular applications of balanced fertilizer during the growing season. Avoid over-fertilization.,Fertilize with a slow-release fertilizer in early spring and a high-phosphorus formula just before blooming.
Murraya exotica,Seasonal Variations,Grows actively during spring and summer; may require protection from frost in colder regions during winter.,Apply mulch around the base to conserve moisture and regulate soil temperature.
Murraya exotica,Description,"Known for its attractive, fragrant flowers and dense foliage, often used as an ornamental hedge or screen.","Known for its attractive, fragrant flowers and dense foliage, often used as an ornamental hedge or screen."
Murraya exotica,Benefits,"Provides aesthetic value in gardens and landscapes, fragrant flowers attract pollinators.","Provides aesthetic value in gardens and landscapes, fragrant flowers attract pollinators."
Murraya exotica,Pharmacological Properties,No specific pharmacological properties mentioned.,Use under the guidance of a healthcare professional.
Murraya exotica,Edible Properties,Not commonly used as an edible plant.,Not applicable.
Murraya exotica,Cultivation Techniques,Plant in a location that provides adequate space for mature size. Ensure good air circulation.,Plant in a location that provides adequate space for mature size. Ensure good air circulation.
Coleus scutellarioides,Growth Habit,"Perennial herbaceous plant, thriving in flower beds and as potted plants due to its vibrant foliage.",Select a spacious pot to accommodate rapid growth and prevent overcrowding.
Coleus scutellarioides,Soil Requirements,"Prefers well-draining, nutrient-rich soil; organic compost or a potting mix with perlite is ideal.",Use a high-quality potting mix with good drainage and water retention properties.
Coleus scutellarioides,Water Requirements,Needs consistent moisture but not waterlogged; water when the top inch of soil feels dry.,Water regularly to keep the soil evenly moist; adjust watering based on temperature and humidity.
Coleus scutellarioides,Light Conditions,Requires bright light to maintain vivid leaf coloration; partial shade is suitable in very hot climates.,Position in a location that receives several hours of indirect sunlight daily.
Coleus scutellarioides,Pests and Diseases,Susceptible to pests like spider mites and mealybugs; regular inspections and natural insecticides recommended.,Regularly check for pests and treat with appropriate eco-friendly pesticides.
Coleus scutellarioides,Control Methods,Regularly check for pests and treat with appropriate eco-friendly pesticides.,Provide adequate air circulation and avoid overhead watering to prevent disease.
Coleus scutellarioides,Fertilization Requirements,"Responds well to light feeding; use a balanced, slow-release fertilizer every 4-6 weeks during the growing season.",Fertilize lightly but regularly during the active growth period to support lush foliage.
Coleus scutellarioides,Seasonal Variations,"Growth can slow down in winter; in colder regions, it needs protection from frost.",Protect from extreme cold by moving indoors or using frost cloths.
Coleus scutellarioides,Description,"Known for its colorful foliage, making it a popular choice for decorative borders and containers.","Known for its colorful foliage, making it a popular choice for decorative borders and containers."
Coleus scutellarioides,Benefits,"Adds vibrant color to gardens and indoor spaces, easy to grow and care for.","Adds vibrant color to gardens and indoor spaces, easy to grow and care for."
Coleus scutellarioides,Pharmacological Properties,No specific pharmacological properties mentioned.,Use under the guidance of a healthcare professional.
Coleus scutellarioides,Edible Properties,Not commonly used as an edible plant.,Not applicable.
Coleus scutellarioides,Cultivation Techniques,Select a spacious pot to accommodate rapid growth and prevent overcrowding.,Select a spacious pot to accommodate rapid growth and prevent overcrowding.
Chinese money plant,Growth Habit,"A succulent with round, coin-like leaves that cascade beautifully, making it perfect for hanging baskets.","Choose a pot with drainage holes and use a light, porous potting mix to enhance soil aeration."
Chinese money plant,Soil Requirements,"Prefers well-draining, sandy or gritty soil with moderate organic content to ensure good aeration and prevent water logging.","Water thoroughly but infrequently, ensuring that the soil is completely dry before watering again."
Chinese money plant,Water Requirements,"Water sparingly, allowing the soil to dry out completely between waterings. Over-watering can lead to root rot, especially in cooler months.",Place in a location that receives ample but indirect sunlight or morning sun.
Chinese money plant,Light Conditions,"Thrives in bright, indirect light but can tolerate direct morning sunlight. Avoid intense afternoon sun to prevent leaf burn.","Provide bright, indirect light and avoid intense afternoon sun to prevent leaf burn."
Chinese money plant,Pests and Diseases,Watch for common pests like aphids and mealybugs. Treat with insecticidal soap or neem oil if infestation occurs.,"Inspect regularly for pests and diseases, and isolate infected plants to prevent spread."
Chinese money plant,Control Methods,"Inspect regularly for pests and diseases, and isolate infected plants to prevent spread.",Maintain moderate humidity and good ventilation to reduce risk of fungal diseases.
Chinese money plant,Fertilization Requirements,"Fertilize lightly during the growing season with a balanced, water-soluble fertilizer, diluted to half the recommended strength.",Apply a diluted low-dose balanced fertilizer during the active growth phase; avoid feeding in dormant periods.
Chinese money plant,Seasonal Variations,More tolerant of heat than cold; protect from temperatures below 5掳C. Reduce watering in winter to prevent cold moisture damage.,Monitor temperature changes and protect from frost by bringing indoors or using frost cloths.
Chinese money plant,Description,"Known for its attractive, round leaves and easy care, making it a popular houseplant.","Known for its attractive, round leaves and easy care, making it a popular houseplant."
Chinese money plant,Benefits,Improves indoor air quality and adds aesthetic value to indoor spaces.,Improves indoor air quality and adds aesthetic value to indoor spaces.
Chinese money plant,Pharmacological Properties,No specific pharmacological properties mentioned.,Use under the guidance of a healthcare professional.
Chinese money plant,Edible Properties,Not commonly used as an edible plant.,Not applicable.
Chinese money plant,Cultivation Techniques,"Choose a pot with drainage holes and use a light, porous potting mix to enhance soil aeration.","Choose a pot with drainage holes and use a light, porous potting mix to enhance soil aeration."
Cymbidium faberi,Growth Habit,"Cymbidium faberi, also known as the Hardy Chinese Cymbidium, is a terrestrial orchid species with strong, upright, V-shaped, and serrated leaves.",Plant in a pot with adequate drainage holes using an orchid-specific potting mix.
Cymbidium faberi,Soil Requirements,"Prefers well-draining, rich in organic material soil. It thrives in a mixture that allows good root aeration and drainage to prevent root rot.",Water thoroughly but allow the top inch of soil to dry out between waterings.
Cymbidium faberi,Water Requirements,"Requires moderate watering, keeping the soil consistently moist but not waterlogged. Reduce watering in the winter to prevent root issues.","Place in a location that receives a lot of bright, indirect sunlight or partial shade."
Cymbidium faberi,Light Conditions,"Enjoys bright, indirect light but can tolerate low light conditions. Avoid direct sunlight in hot climates to prevent leaf burn.",Apply fertilizer during the active growing phase; cease in winter.
Cymbidium faberi,Pests and Diseases,Common pests include spider mites and scale insects. Use appropriate insecticides or natural remedies like neem oil for treatment.,"Monitor and adjust care seasonally, particularly protecting the plant from extreme temperatures."
Cymbidium faberi,Control Methods,"Monitor and adjust care seasonally, particularly protecting the plant from extreme temperatures.",Regularly inspect for pests and treat as necessary to prevent infestations.
Cymbidium faberi,Fertilization Requirements,"Feed with a balanced, water-soluble orchid fertilizer diluted to half strength every month during the growing season. Do not fertilize in the dormant winter months.",Apply fertilizer during the active growing phase; cease in winter.
Cymbidium faberi,Seasonal Variations,Thrives in temperatures between 15-25掳C. Protect from temperatures below 5掳C and above 30掳C to prevent stress and damage.,Regularly inspect for pests and treat as necessary to prevent infestations.
Cymbidium faberi,Description,"Known for its attractive, fragrant flowers and ease of care, making it a popular choice for ornamental use.","Known for its attractive, fragrant flowers and ease of care, making it a popular choice for ornamental use."
Cymbidium faberi,Benefits,"Provides aesthetic value in gardens and as indoor plants, known for its long-lasting flowers.","Provides aesthetic value in gardens and as indoor plants, known for its long-lasting flowers."
Cymbidium faberi,Pharmacological Properties,No specific pharmacological properties mentioned.,No specific pharmacological properties mentioned.
Cymbidium faberi,Edible Properties,Not commonly used as an edible plant.,Not commonly used as an edible plant.
Cymbidium faberi,Cultivation Techniques,Plant in a pot with adequate drainage holes using an orchid-specific potting mix.,Plant in a pot with adequate drainage holes using an orchid-specific potting mix.
Chlorophytum comosum 'Variegatum',Growth Habit,"An evergreen perennial with slender, arching leaves, highlighted by a stripe of golden edging, adding a decorative touch.",Use a pot with good drainage holes and a well-draining potting mix to prevent waterlogging.
