Species,Aspect,Information,Measure
Plant,Description,"Growing plants requires understanding the plant's growing conditions, such as light, water, soil type, and temperature requirements. It is also crucial to choose the right plant variety and season to ensure the plant will grow healthily in a specific environment.","Regularly monitor the growth status of plants, including measuring the height, number of leaves, and health of plants. Adjust watering, fertilization, and pest and disease control measures based on the monitoring results to ensure good plant growth."
Plant,Growth Habit,"The growth habit of plants determines their shape, structure, and growth rate.","Observe and record plant height, branching, and growth rate, adjusting cultivation methods accordingly."
Plant,Soil Requirements,"Different plants have varying soil requirements, including pH, drainage, and nutrient levels.","Test soil pH and nutrient levels, amending soil as necessary."
Plant,Water Requirements,Plants' water needs depend on their species and growth stage; too much or too little water affects health.,"Regularly check soil moisture, adjusting watering frequency and amount."
Plant,Light Conditions,"Plants have varying light requirements, with some needing full sun and others thriving in shade.","Adjust light exposure according to plant needs, using shade cloths or artificial lights."
Plant,Pests and Diseases,"Plants are susceptible to various pests and diseases, requiring timely monitoring and treatment.","Regularly inspect plants, identify pests and diseases, and take appropriate control measures."
Plant,Control Methods,"Physical, biological, and chemical methods are used to control plant pests and diseases to ensure healthy growth.","Implement and document the effectiveness of various control methods, optimizing pest and disease management strategies."
Plant,Fertilization Requirements,Plants require specific types and amounts of fertilizer at different growth stages to promote growth and development.,"Apply appropriate fertilizers based on plant needs and growth stage, monitoring the effects."
Plant,Seasonal Variations,"Seasonal climate changes affect plant growth, necessitating adjustments in cultivation management.","Adjust watering, fertilization, and pruning schedules to ensure plants adapt to seasonal changes."
Plant,Benefits,"Plants offer various ecological, economic, and health benefits.","Assess the specific benefits of plants to the environment and humans, optimizing plant selection."
Plant,Pharmacological Properties,Some plants have pharmacological properties that can be used for treating and preventing diseases.,Research and document the pharmacological components and effects of plants for safe and effective use.
Plant,Edible Properties,"Many plants are edible, providing nutritional and health benefits.","Identify the edible parts and preparation methods of plants, ensuring safe consumption."
Plant,Cultivation Techniques,"Cultivation techniques include planting, transplanting, pruning, and harvesting to optimize growth and yield.","Learn and apply advanced cultivation techniques, recording and analyzing their effects."
Dandelion,Growth Habit,Dandelion is a hardy plant that can grow in a variety of conditions.,Regular pruning and control measures can help maintain dandelion growth.
Dandelion,Soil Requirements,"Dandelion prefers rich, well-drained soil.",Use well-draining soil to prevent waterlogging.
Dandelion,Water Requirements,Dandelion should be watered regularly but not overwatered.,Water when the top inch of soil feels dry.
Dandelion,Light Conditions,Dandelion thrives in full sunlight.,Place in a location with full sunlight.
Dandelion,Pests and Diseases,Dandelion can be affected by pests such as aphids.,Monitor for pests and treat with appropriate measures.
Dandelion,Control Methods,Control methods for dandelion pests include using insecticidal soap.,Use insecticidal soap to control pests.
Dandelion,Fertilization Requirements,Dandelion does not require heavy fertilization. A balanced fertilizer can be applied during the growing season.,Apply a balanced fertilizer during the growing season.
Dandelion,Seasonal Variations,Dandelion's growth may slow down during the winter months.,Adjust watering and care based on seasonal changes.
Dandelion,Description,Dandelion has a range of medicinal properties and can be used to treat various conditions.,Consult a healthcare professional before using dandelion medicinally.
Dandelion,Benefits,Dandelion has been used to treat women's health issues and promote lactation.,Use under the guidance of a healthcare professional.
Dandelion,Pharmacological Properties,"Dandelion has anti-inflammatory and antibacterial properties, and can aid in digestion.",Should be used under the guidance of a healthcare professional.
Dandelion,Edible Properties,"Dandelion leaves can be eaten raw or cooked, and the flowers and roots can also be used in various ways.",Dandelion leaves and roots can be consumed in various forms.
Dandelion,Cultivation Techniques,Dandelion can be grown from seed or by division of the root.,Dandelion can be propagated from seeds or root divisions.
Golden Pothos,Growth Habit,"Golden Pothos is a vigorous vine that can grow over 10 feet in length, suitable for hanging baskets or climbing supports.","Use clean scissors to trim stems close to the base, but not below the soil line."
Golden Pothos,Soil Requirements,"Use a well-draining potting mix to prevent waterlogging, which can lead to root rot.","Use loose, fertile, well-drained soil, such as garden soil with a small amount of perlite or sand."
Golden Pothos,Water Requirements,Water the Golden Pothos when the top inch of soil feels dry to the touch. Avoid overwatering.,Water when the soil surface is dry to the touch. Avoid overwatering.
Golden Pothos,Light Conditions,"Thrives in bright indirect light, but can tolerate lower light conditions. Avoid direct sunlight.",Place in a bright location near a window but avoid direct sunlight.
Golden Pothos,Pests and Diseases,"Golden Pothos can be affected by pests such as aphids, whiteflies, and spider mites.",Monitor for pests and treat with appropriate measures.
Golden Pothos,Control Methods,Treat these pests by first removing any visible pests and then using a mild insecticidal soap or neem oil.,Use a mild insecticidal soap or neem oil as needed.
Golden Pothos,Fertilization Requirements,Golden Pothos is not a heavy feeder. Apply a balanced liquid fertilizer diluted to half strength once every 2-4 weeks during the growing season.,Apply a diluted balanced liquid fertilizer every 2-4 weeks during the growing season.
Golden Pothos,Seasonal Variations,"Requires consistent care throughout the year, with adjustments in watering frequency based on seasonal changes.",Adjust watering frequency according to seasonal changes.
Golden Pothos,Description,Pothos is highly ornamental and can be grown indoors or outdoors for its ornamental value.,Can be trained to climb on supports or hang in various locations.
Golden Pothos,Benefits,Pothos can effectively absorb harmful gases such as formaldehyde and benzene in the air.,Place pothos in areas where air purification is needed.
Golden Pothos,Pharmacological Properties,"According to the 'Compendium of Materia Medica', pothos has medicinal properties that can treat bruises, reduce swelling and pain, and inhibit bacteria.",Use under the guidance of a professional for medicinal purposes.
Golden Pothos,Edible Properties,No known edible properties.,Not applicable.
Golden Pothos,Cultivation Techniques,"Pothos propagation is typically done through cuttings. In late spring and early summer, select robust pothos vines, cut 15-30 cm branches, and insert directly into the cultivation soil.","For propagation, select robust vines, cut branches, and insert into cultivation soil."
Jasmine,Growth Habit,Jasmine is an upright or climbing shrubby plant that grows up to 3 meters tall.,Provide suitable support structures for jasmine to climb.
Jasmine,Soil Requirements,Jasmine flowers prefer slightly acidic sandy soils that contain a lot of humus.,"Choose a slightly acidic soil rich in organic matter and well-drained, such as sandy soil or soil containing humus."
Jasmine,Water Requirements,"Jasmine likes a humid environment, but it should not accumulate water for a long time, otherwise it will cause root rot.","Keep the soil moist, but not too wet. Ensure proper drainage to prevent root rot."
Jasmine,Light Conditions,"Jasmine flowers like light, but cannot be directly exposed to bright light. It is better for growing in semi-shade.","Choose a place that is bright but avoids direct sunlight. If planted outdoors, provide partial shade."
Jasmine,Pests and Diseases,"The main diseases of jasmine are white silk, anthracnose, leaf spot and soot.",Monitor for diseases and treat with appropriate fungicides.
Jasmine,Control Methods,"Control red spiders (mites) by biological control, removing dead leaves, and using specific miticides.",Use specific miticides and biological control methods.
Jasmine,Fertilization Requirements,"Jasmine loves fertilizer and needs regular fertilization. Organic fertilizer or chemical fertilizer can be used, but not excessive.","Use fermented bean cake, fish water fertilizer, or chemical fertilizers such as ammonium sulfate and superphosphate."
Jasmine,Seasonal Variations,"Jasmine flowers have different growth needs in different seasons. In winter, it needs to enter a dormant period, when watering and fertilizing need to be reduced. In the spring and summer, it will enter the growing season and need more water and fertilizer.",Adjust watering and fertilization frequency based on seasonal changes.
Jasmine,Description,"Jasmine is a fragrant, white flower that many people grow at home for its natural fragrance and air-purifying qualities.",Maintain well-draining and slightly acidic soil. Provide consistent watering and ample sunlight.
Jasmine,Benefits,Jasmine can purify the air and has aesthetic value.,Place jasmine in areas where air purification is needed.
Jasmine,Pharmacological Properties,"Jasmine has medicinal properties that can be used for various treatments. However, it should be used under the guidance of a professional.",Use under the guidance of a healthcare professional.
Jasmine,Edible Properties,No known edible properties.,Not applicable.
Jasmine,Cultivation Techniques,"Jasmine can be propagated through cuttings, layering, and pruning techniques.","Use cuttings, layering, and pruning techniques to propagate jasmine."
Sunflower,Growth Habit,"Sunflower seeds germinate quickly. If the weather is suitable, they can sprout in 5-7 days. Before germination, seeds should be kept in a cool place. Once the seedling appears, it should be moved to a location with sunlight to prevent leggy growth.","Keep the seeds in a cool place before germination. Once the seedling appears, move it to a location with sunlight."
Sunflower,Soil Requirements,Sunflower seeds can be planted directly in the ground. They prefer a location with full sun and well-drained soil. Seeds should be planted 2.5cm deep and spaced 15cm apart.,Plant sunflower seeds in a location with full sun and well-drained soil. Seeds should be planted 2.5cm deep and spaced 15cm apart.
Sunflower,Water Requirements,"Young sunflower seedlings require regular watering to keep the soil around them moist. They should be protected from pests such as birds, squirrels, and slugs, which can be done by covering the soil with a net.",Water the young sunflower seedlings regularly to keep the soil moist. Protect them from pests by covering the soil with a net.
Sunflower,Light Conditions,Sunflowers need ample sunlight. They should be placed in a location that receives full sun for optimal growth.,Place the sunflower plants in a location that receives full sun for optimal growth.
Sunflower,Pests and Diseases,"Pests such as birds, squirrels, and slugs can be a problem for sunflowers.",Monitor for pests and take appropriate measures to control them.
Sunflower,Control Methods,"Use a net to cover the soil, or place a ring of slug bait or insect repellent around the planting area to create a protective barrier.","Use a net to cover the soil, or place a ring of slug bait or insect repellent around the planting area to create a protective barrier."
Sunflower,Fertilization Requirements,"Mature sunflower plants should be watered once a week. During dry weather, the watering frequency should be increased. Sunflowers require more water than other annual flowers. If necessary, stakes can be used to support the plants.",Water mature sunflower plants once a week. Increase the watering frequency during dry weather. Use stakes to support the plants if necessary.
Sunflower,Seasonal Variations,"Sunflowers can be harvested for their seeds once the back of the flower head turns from green to brown. If you want to collect seeds for roasting or planting next year, you can cover the flower head with a paper bag to protect it from birds.",Harvest sunflowers for their seeds once the back of the flower head turns brown. Cover the flower head with a paper bag to protect it from birds if you want to collect seeds.
Sunflower,Description,"Sunflowers are known for their large, bright yellow flowers that follow the sun during the day.","Sunflowers are known for their large, bright yellow flowers that follow the sun during the day."
Sunflower,Benefits,Sunflowers provide seeds that are rich in nutrients and can be consumed as snacks or used in cooking.,Sunflower seeds are rich in nutrients and can be consumed as snacks or used in cooking.
Sunflower,Pharmacological Properties,Sunflower seeds contain compounds that have antioxidant and anti-inflammatory properties.,Use under the guidance of a healthcare professional.
Sunflower,Edible Properties,"Sunflower seeds can be roasted and eaten, or used in baking and cooking. The oil extracted from sunflower seeds is also widely used.","Sunflower seeds can be roasted and eaten, or used in baking and cooking. The oil extracted from sunflower seeds is also widely used."
Sunflower,Cultivation Techniques,"Sunflower seeds have a thick shell, so they need to be soaked in water for 3-6 hours after opening the package. Choose large, full seeds for planting to ensure a high germination rate.","Soak the sunflower seeds in water for 3-6 hours before planting. Choose large, full seeds for planting to ensure a high germination rate."
Tulip,Growth Habit,"Tulips are perennial herbaceous plants with large, solitary, brightly colored flowers.","Tulips are perennial herbaceous plants with large, solitary, brightly colored flowers."
Tulip,Soil Requirements,"Tulips prefer a sandy, well-drained soil with a pH not less than 6. They can be grown in a mixture of peat, rotten soil, and sand in a 1:1:1 ratio.","Tulips prefer a sandy, well-drained soil with a pH not less than 6. They can be grown in a mixture of peat, rotten soil, and sand in a 1:1:1 ratio."
Tulip,Water Requirements,"Tulips require regular watering during their growth and blooming period, but should be kept relatively dry during the summer when they are dormant. After planting, the soil should be thoroughly watered to ensure a good combination of soil and bulbs.","Tulips require regular watering during their growth and blooming period, but should be kept relatively dry during the summer when they are dormant. After planting, the soil should be thoroughly watered to ensure a good combination of soil and bulbs."
Tulip,Light Conditions,"Tulips need full sun for at least six hours a day. They will not bloom well if they do not get enough light. After potting for more than half a month, appropriate shading should be provided to facilitate the rooting of the bulbs.","Tulips need full sun for at least six hours a day. They will not bloom well if they do not get enough light. After potting for more than half a month, appropriate shading should be provided to facilitate the rooting of the bulbs."
Tulip,Pests and Diseases,"Generally, tulips will not have pest problems. If pest problems occur, it may be due to the packaging rot during transportation, leading to the infection of the bulbs by bacteria.","Generally, tulips will not have pest problems. If pest problems occur, it may be due to the packaging rot during transportation, leading to the infection of the bulbs by bacteria."
Tulip,Control Methods,"Before planting, thorough soil disinfection and bulb disinfection should be carried out. Disease management includes regular inspection, proper sanitation, and the use of appropriate fungicides if necessary.","Before planting, thorough soil disinfection and bulb disinfection should be carried out. Disease management includes regular inspection, proper sanitation, and the use of appropriate fungicides if necessary."
Tulip,Fertilization Requirements,"Tulips are not demanding in terms of fertilizer. If the growth is weak, some nitrogen fertilizer or some general-purpose nutrient solution can be applied.","Tulips are not demanding in terms of fertilizer. If the growth is weak, some nitrogen fertilizer or some general-purpose nutrient solution can be applied."
Tulip,Seasonal Variations,"Tulips bloom in the spring. They require a period of cold dormancy, known as vernalization, to bloom. Tulips should be planted in the fall, 4 to 6 inches deep, depending on the size of the bulb.","Tulips bloom in the spring. They require a period of cold dormancy, known as vernalization, to bloom. Tulips should be planted in the fall, 4 to 6 inches deep, depending on the size of the bulb."
Tulip,Description,"Tulips are perennial herbaceous plants with large, solitary, brightly colored flowers.","Tulips are perennial herbaceous plants with large, solitary, brightly colored flowers."
Tulip,Benefits,"Tulips are known for their bright and beautiful flowers, which are often used in floral arrangements and gardens.","Tulips are known for their bright and beautiful flowers, which are often used in floral arrangements and gardens."
Tulip,Pharmacological Properties,Tulips contain compounds that have antioxidant and anti-inflammatory properties.,Use under the guidance of a healthcare professional.
Tulip,Edible Properties,No known edible properties.,Not applicable.
Tulip,Cultivation Techniques,"To grow tulips, plant bulbs in the fall, 4 to 6 inches deep, in sandy, well-drained soil.","To grow tulips, plant bulbs in the fall, 4 to 6 inches deep, in sandy, well-drained soil."
Chamomile,Growth Habit,"Chamomile is a perennial herbaceous plant that can be found in Europe, North America, and Northern Africa. It grows to a height of 30-40 cm with a straight stem and many branches. The leaves are alternate, with 2-3 pinnate divisions. The inflorescence is a head with a diameter of 1.2-2.5cm, arranged in an umbel shape, and is located at the top of the stem or in the axils of the leaves.","Chamomile is a perennial herbaceous plant that can be found in Europe, North America, and Northern Africa. It grows to a height of 30-40 cm with a straight stem and many branches. The leaves are alternate, with 2-3 pinnate divisions. The inflorescence is a head with a diameter of 1.2-2.5cm, arranged in an umbel shape, and is located at the top of the stem or in the axils of the leaves."
Chamomile,Soil Requirements,Chamomile can adapt to various types of soil and environments. It can be found on plains and at altitudes up to 2000 meters.,Chamomile can adapt to various types of soil and environments. It can be found on plains and at altitudes up to 2000 meters.
Chamomile,Water Requirements,"Chamomile loves water and is easy to dehydrate. After receiving the chamomile, the packaging should be removed, the stem should be cut at a 45-degree angle, and the chamomile should be soaked in deep water for about 5 hours for flower awakening.","Chamomile loves water and is easy to dehydrate. After receiving the chamomile, the packaging should be removed, the stem should be cut at a 45-degree angle, and the chamomile should be soaked in deep water for about 5 hours for flower awakening."
Chamomile,Light Conditions,"Chamomile needs sufficient sunlight but cannot be exposed to the sun. It should be placed in a position with scattered light, such as a bright living room without lights, or a windowsill with a light veil.","Chamomile needs sufficient sunlight but cannot be exposed to the sun. It should be placed in a position with scattered light, such as a bright living room without lights, or a windowsill with a light veil."
Chamomile,Pests and Diseases,"Chamomile generally does not have pest problems. However, if pest problems occur, it may be due to the packaging rot during transportation, leading to the infection of the bulbs by bacteria.","Chamomile generally does not have pest problems. However, if pest problems occur, it may be due to the packaging rot during transportation, leading to the infection of the bulbs by bacteria."
Chamomile,Control Methods,"Before planting, thorough soil disinfection and bulb disinfection should be carried out.","Before planting, thorough soil disinfection and bulb disinfection should be carried out."
Chamomile,Fertilization Requirements,"Chamomile does not require much fertilizer. However, it can benefit from the addition of nutrients such as vitamin C, sugar, and preservatives to the water during maintenance.","Chamomile does not require much fertilizer. However, it can benefit from the addition of nutrients such as vitamin C, sugar, and preservatives to the water during maintenance."
Chamomile,Seasonal Variations,"Chamomile blooms for a long period of time, and with good care, it can be observed for 7-20 days or more. It symbolizes growth in adversity, unyielding strength in hardship, and vitality.","Chamomile blooms for a long period of time, and with good care, it can be observed for 7-20 days or more. It symbolizes growth in adversity, unyielding strength in hardship, and vitality."
Chamomile,Description,"Chamomile is a perennial herbaceous plant that can be found in Europe, North America, and Northern Africa. It grows to a height of 30-40 cm with a straight stem and many branches. The leaves are alternate, with 2-3 pinnate divisions. The inflorescence is a head with a diameter of 1.2-2.5cm, arranged in an umbel shape, and is located at the top of the stem or in the axils of the leaves.","Chamomile is a perennial herbaceous plant that can be found in Europe, North America, and Northern Africa. It grows to a height of 30-40 cm with a straight stem and many branches. The leaves are alternate, with 2-3 pinnate divisions. The inflorescence is a head with a diameter of 1.2-2.5cm, arranged in an umbel shape, and is located at the top of the stem or in the axils of the leaves."
Chamomile,Benefits,"Chamomile is known for its calming and soothing properties, often used in teas and herbal remedies.","Chamomile is known for its calming and soothing properties, often used in teas and herbal remedies."
Chamomile,Pharmacological Properties,"The pyrethrins, flavonoids, and essential oils in chamomile have different inhibitory effects on fungal growth. Flavonoids are the main anti-inflammatory components, but polysaccharides isolated from chamomile inflorescences also have anti-inflammatory effects.","The pyrethrins, flavonoids, and essential oils in chamomile have different inhibitory effects on fungal growth. Flavonoids are the main anti-inflammatory components, but polysaccharides isolated from chamomile inflorescences also have anti-inflammatory effects."
Chamomile,Edible Properties,"Chamomile can be used to make tea, which is known for its soothing and calming effects.","Chamomile can be used to make tea, which is known for its soothing and calming effects."
Chamomile,Cultivation Techniques,"Chamomile can be propagated by seeds or cuttings, and it grows well in a variety of soil types.","Chamomile can be propagated by seeds or cuttings, and it grows well in a variety of soil types."
Eustoma grandiflorum,Growth Habit,"Eustoma grandiflorum, commonly known as Lisianthus or Prairie Gentian, is a one or two-year-old herbaceous plant in the Gentianaceae family. It has a straight stem; leaves are opposite, ovate, wedge-shaped at the base, and overall grey-green; the corolla is bell-shaped, with a variety of colors including red, purple, white, yellow, and edged, and there are single and double petals; the flowering period is from May to October; the fruiting period is in October.","Eustoma grandiflorum, commonly known as Lisianthus or Prairie Gentian, is a one or two-year-old herbaceous plant in the Gentianaceae family. It has a straight stem; leaves are opposite, ovate, wedge-shaped at the base, and overall grey-green; the corolla is bell-shaped, with a variety of colors including red, purple, white, yellow, and edged, and there are single and double petals; the flowering period is from May to October; the fruiting period is in October."
Eustoma grandiflorum,Soil Requirements,Eustoma grandiflorum is native to the limestone areas between southern United States and Mexico. It prefers warm and humid environments and is not tolerant of heat. The suitable temperature for growth is 15鈩? and it dislikes waterlogging. It prefers moist and fertile soil.,Eustoma grandiflorum is native to the limestone areas between southern United States and Mexico. It prefers warm and humid environments and is not tolerant of heat. The suitable temperature for growth is 15鈩? and it dislikes waterlogging. It prefers moist and fertile soil.
